Tourist_Spot,Address,Zipcode,lon,lat,geoAddress
American Stock Exchange Building,"86 Trinity Place New York, NY 10006, Lower Manhattan",10006,-74.0126146,40.708678,"86 trinity pl, new york, ny 10006, usa"
Pier 40,"353 West St Manhattan, NY 10014, Greenwich Village",10014,-74.0122049,40.7288194,"353 west st, new york, ny 10014, usa"
Long Island City Partnership,"mail: 27-01 Queens Plaza North, 9th fl. Queens, NY 11101, Long Island City",11101,-73.9387435,40.7508189,"27-01 queens plaza n #9th, queens, ny 11101, usa"
"The Great Hall, Cooper Union","7 East 7th Street Manhattan, NY 10003, East Village",10003,-73.9904866,40.7294081,"foundation building, 41 cooper square, 7 e 7th st, new york, ny 10003, usa"
Czech Center New York,"321 E 73rd St Manhattan, NY, Upper East Side",10021,-73.9564666,40.7689984,"321 e 73rd st, new york, ny 10021, usa"
The Malcolm X and Dr. Betty Shabazz Memorial & Educational Center,"3940 Broadway Manhattan, NY, Harlem",10032,-73.9402071,40.8389411,"3940 broadway, new york, ny 10032, usa"
79th Street Boat Basin,"W 79th St and the Hudson River Manhattan, NY 10024, Upper West Side",10024,-73.9799099,40.7838215,"w 79th st, new york, ny, usa"
New York City Center,"W. 55th St. betw. Sixth & Seventh Aves.; mail: 130 W. 56th St. Manhattan, NY 10019, Midtown West",10019,-73.985207,40.7660018,"w 55th st, new york, ny, usa"
Electric Lady Studios,"52 W 8th St New York, NY 10011 West Village",10011,-73.9989778,40.7330355,"52 w 8th st, new york, ny 10011, usa"
Harlem Park to Park,"mail: 134 W. 118th St., ground fl. Manhattan, NY 10026, Harlem",10026,-73.9502985,40.8037892,"134 w 118th st, new york, ny 10026, usa"
St. Bartholomew's Church,"325 Park Ave Manhattan, NY, Midtown East",10022,-73.9731084,40.7572236,"325 park ave, new york, ny 10022, usa"
Kissena Golf Course,"16415 Booth Memorial Ave Queens, NY 11365, Fresh Meadows",11365,-73.7992634,40.7449083,"16415 booth memorial ave, fresh meadows, ny 11365, usa"
Riverside Park South,"Henry Hudson Parkway at W. 70th St. Manhattan, NY 10023, Upper West Side",10023,-73.9822179,40.7771556,"w 70th st, new york, ny 10023, usa"
Poets House,"10 River Terr. Manhattan, NY 10282, Battery Park City",10282,-74.0162945,40.7158788,"10 river terrace, new york, ny 10282, usa"
